"id","published","category","sectionOrder","title","code","termCode","term","termLabel","programs","programTagsDisplay","credits","instructorName","instructorSlug","instructorUrl","subtitle","descriptionShort","descriptionMore","tstCode","format","meetingDay","meetingTime","syllabusUrl","requiredBooks","prerequisites","cstcArea","certificateTags","enrolmentNotes","registrationEmail","lastDateToRegister","maxEnrolment","partnerNote","updatedAt"
"icsd-260005-w23-5e4c1","FALSE","concentration-admin","","How to Coach A Strong Team: Leading People, Building Institutional Capacity, and Securing Accountability","ICSD 260005","W23","winter23","Winter 2023","mael","MA-EL","3 Credits","Dr. Gideon Strauss","5","https://faculty.icscanada.edu/gstrauss","","*How to Coach A Strong Team* is a course for current and aspiring school administrators who want to cultivate their people skills. The course will focus on the competencies involved in having crucial conversations and coaching colleagues for professional development purposes, while also providing opportunities for learning about the competencies relevant to talent acquisition and employment termination. The backbone of the course will be a series of meditations (in the Reformational philosophical tradition) on being human: imaging God in the world.","*How to Coach A Strong Team* is a remote learning course consisting of six synchronous sessions including three school visits and a debriefing session with an expert practitioner, thirteen weeks of asynchronous online interaction, and the writing of a playbook by each student taking the course for credit. All of the synchronous sessions will be by means of online video, with the possible exception of one of the school visits. The exception may include an on-site, in-person option as part of a hybrid package, depending on circumstances. Team auditors will have access to five of the six synchronous sessions (including the school visits and the expert practitioner debriefing) and a team audit study guide for reading and talking through the course materials in their team contexts.","","Blended (Online Asynchronous/Synchronous)","","","https://docs.google.com/document/d/e/2PACX-1vQnU_UM18cZzlchtTOeul_6F8d8AUbOeo7ReEpXo-IoAYnvE3CIXV3H0a7-6QdiT33HHi09pXPxDCJL/pub","","","","","To register for this course, email academic-registrar@icscanada.edu. Last date to register January 13, 2023. Maximum enrolment of nine (9) students. ICS reserves the right to decline registrations.","academic-registrar@icscanada.edu","","9","","2022-10-18"
"ics-140908-240908-w23-9da07","FALSE","immersive","","Nothing Can Separate Us...!: The Dialectical Materialism of Slavoj Žižek","ICS 140908 / 240908","W23","winter23","Winter 2023","ma mws phd","MA, MWS, PhD","3 Credits","Dr. Jim Olthuis","","https://faculty.icscanada.edu/jolthuis","","This seminar will map out the Dialectical Materialism of Slovenian philosopher, psycho-analyst, and cultural critic Slavoj Žížek. A communist and atheist, Žižek's thought is an original Lacanian inspired repeat of Hegel that recalibrates Materialism. Žížek's incisive structural insights will be explored even as his faith in the Void as the eternal traumatic Real is contrasted with faith in the steadfast Love of God.","","ICT5704HS L0101","","Wednesdays","6pm - 9pm ET","https://docs.google.com/document/d/e/2PACX-1vT7IQ5SBwN2iZJ8fXMSLXGA4HvVDmLnZIPU7EKhUtBV-nz1MfMV2bjREm0CLcxiRq1DiysKxGZSB_Mt/pub","","","","","To register for this course, email academic-registrar@icscanada.edu. Last date to register January 13, 2023. Maximum enrolment of nine (9) students. ICS reserves the right to decline registrations.
Attention TST students: if you are interested in taking this course for credit, you must petition your college of registration to count the course credit toward your degree program.*","academic-registrar@icscanada.edu","","9","","2022-10-18"
"ics-1107ac-2107ac-w23-aa35b","FALSE","partnership","","Religion, Life and Society: Reformational Philosophy","ICS 1107AC / 2107AC","W23","winter23","Winter 2023","ma mws phd","MA, MWS, PhD","3 Credits","Dr. Bob Sweetman","1","https://faculty.icscanada.edu/bsweetman","","An exploration of central issues in philosophy, as addressed by Herman Dooyeweerd, Dirk Vollenhoven, and the ""Amsterdam School"" of neoCalvinian thought. The course tests the relevance of this tradition for recent developments in Western philosophy. Special attention is given to critiques of foundationalism, metaphysics, and modernity within reformational philosophy and in other schools of thought.","","ICT3702HS","","Tuesdays","10am - 1pm ET","https://docs.google.com/document/d/e/2PACX-1vTKTZXIAeuoKFLI2FjF3fy3m51scHuE3J77qUaCbWV7MsUhsUkXyBXVuaBYf56u8g/pub","","","","","To register for this course, email academic-registrar@icscanada.edu. Last date to register January 13, 2023. Maximum enrolment of nine (9) students. ICS reserves the right to decline registrations.
Attention TST students: if you are interested in taking this course for credit, you must petition your college of registration to count the course credit toward your degree program.*","academic-registrar@icscanada.edu","","9","In Partnership with Calvin University","2022-10-18"
"spiritual-exercise-as-christian-9796b","FALSE","immersive","","Spiritual Exercise as Christian Philosophy from Augustine to Bonaventure","","","","","ma mws phd","MA, MWS, PhD","3 Credits","Dr. Bob Sweetman","1","https://faculty.icscanada.edu/bsweetman","","","","","","Thursdays","6pm - 9pm ET","https://docs.google.com/document/d/e/2PACX-1vS7LgjE91QAs7UsLGsLTAn5PeTgxA_yoNCZ6Y18AvJn7ZJ77Hiq4wUKpjE9c2Cj2w/pub","","","","","(MWS, MA, PhD)

Syllabus

Enrolment Notes:
To register for this course, email academic-registrar@icscanada.edu. Last date to register January 13, 2023. Maximum enrolment of nine (9) students. ICS reserves the right to decline registrations.

Attention TST students: if you are interested in taking this course for credit, you must petition your college of registration to count the course credit toward your degree program.*","academic-registrar@icscanada.edu","","9","","2022-10-18"
"icsd-260004-w23-ec9bf","FALSE","concentration-instr","","Deeper Learning: From Wonder to Inquiry to Practice","ICSD 260004","W23","winter23","Winter 2023","cstc mael","MA-EL","3 Credits","Dr. Edith van der Boom","2","https://faculty.icscanada.edu/evanderboom","","CANCELLED","*Deeper Learning: From Wonder to Inquiry to Practice* is a course which seeks to help Christian educators develop deeper learning. We will consider what it means to be image-bearers of God called to care for our neighbours and to be engaged in real work that is part of God's story. Our consideration of these ideas will inform classroom practices and signature pedagogies in apparent, unintended, and even transformative ways. Together we will examine the importance of global citizenship as a form of deeper learning and the impact it has on developing a caring and just world.","","Blended (Online Asynchronous/Synchronous)","","","https://docs.google.com/document/d/e/2PACX-1vS1ilvaDHJf7y_hiJHdmZkAZomjwn2pl33B66_9lImJ6J_Renq2beD_LTNuWBhYYDpUywSGWHZHLRW6/pub","","","Area 3","CSTC","To register for this course, email academic-registrar@icscanada.edu. Last date to register January 13, 2023. Maximum enrolment of nine (9) students. ICS reserves the right to decline registrations.","academic-registrar@icscanada.edu","","9","","2022-10-18"
"biblical-foundations-narrative-53408","FALSE","concentration-instr","","Biblical Foundations: Narrative, Wisdom, and the Art of Interpretation","","","","","cstc ma mael mws phd","CSTC, MA, MA-EL, MWS, PhD","3 Credits","Dr. Nik Ansell","1","mailto:nansell@icscanada.edu","","How can we read and experience the Scriptures as the Word of Life in the midst of an Academy that believes the biblical witness will restrict human freedom and thwart our maturity? How may we pursue biblical wisdom as we ""re-think the world"" when our Christian traditions seem convinced that biblical truth may be disconnected from-or simply applied to-the most pressing and perplexing issues of our time?","This course will explore the Bible-from Genesis to Revelation-as the ongoing story of and for God and all God's creatures, paying special attention to the way in which humanity's attempt to find its way is interwoven with the story of the Divine presence and with the wisdom and promise of creation-new creation. In asking whether and how the biblical story may find its future in our ongoing narratives, we will attempt to identify which hermeneutical methods and sensitivities might help us discern its significance for present day life, including the academic enterprise.

If Jesus is the Living Word at the heart of Scripture, does that change our understanding of where biblical truth is coming from and where it is going? Does the Bible have an implicit, sapiential pedagogy that we have misconstrued? Can the familiar Reformed themes of creation and covenant, election and eschaton speak to us in new, reformational ways? These are some of the questions we shall explore together as we reintroduce ourselves to the biblical writings.

Dr. Nik Ansell
ICS 1108AC / 2108AC F22
ICB2010HF L0101*
Remote (Online Synchronous)
Tuesdays, 4:15pm - 7:15pm ET

(MWS, MA, MA-EL, PhD)","","","Tuesdays","4:15pm - 7:15pm ET","https://docs.google.com/document/d/e/2PACX-1vQa_-ydh-2bxebzd17PToFfQvJel_53IZ8hq6VhEmcn-9L7mEFDQEhcZfkq7tCqnyaSLtTGKhkgf96S/pub","","","Area 1","CSTC","To register for this course, email academic-registrar@icscanada.edu. Last date to register September 16, 2022. Maximum enrolment of nine (9) students. ICS reserves the right to decline registrations.
Attention TST students: you have to contact the ICS Registrar to complete your registration.*","academic-registrar@icscanada.edu","","9","","2022-05-09"
"grace-as-an-aesthetic-concept-c36e4","FALSE","partnership","","Grace as an Aesthetic Concept","","","","","ma mws phd","MA, MWS, PhD","3 Credits","Dr. Rebekah Smick","4","mailto:rsmick@icscanada.edu","","Following Ephesians 2:8, grace is, for Christians, a free gift of salvation bestowed on humankind by God regardless of human merit. ""For by grace you have been saved through faith, and that not of yourselves; it is the gift of God."" As the means by which humans participate in God's plan for humanity, grace is a central theological concept in all forms of Christianity.","In the history of Western aesthetics, the term ""grace"" is also of considerable importance. Generically it indicates beauty in movement and expresses the lightness, spontaneity, and naturalness of this movement together with the charm it exerts. By the 18th century, parallel to the birth of modern aesthetics, the achievement of grace in art was routinely considered art's highest ideal, the ""je ne sais quoi"" - the inexplicable something extra - that guarantees artistic success.

At first glance, these two meanings for this one term seem very far from one another. One attempts to account for the quality of God's interaction with humanity, while the other seeks to describe the surface effects of expressly material goods. It is thus not surprising that these two understandings of grace are rarely thought to intersect, a state of affairs compounded by the fact that the academic study of grace has traditionally only taken place in discrete fields of research. Because of doctrinal differences in the theology of grace, the teaching of grace in Christian seminaries is often part of systematics. Among  historiographers of the arts, the historical concept of grace is often reduced to a matter of style.

By contrast, this interdisciplinary seminar style course will exam the concept of grace within its theological, philosophical, literary, and art theoretical contexts in an effort to more fully understand its historical significance, the points of intersection between its contemporary uses,  and its potential usefulness for the philosophy and theology of art today. We will look at a variety of texts (e.g. from Plato, Cicero, Augustine, John Calvin, Alexander Pope, Friedrich Schiller, Martin Heidegger, Karl Rahner) as well as works of art and literature for which grace is an important and defining aesthetic concept.

Dr. Rebekah Smick
ICS 120103 / 220103 F22

(MWS, MA, PhD)","","","","","https://docs.google.com/document/d/e/2PACX-1vTBpeshPx1h7jd4sKocTUOq_yEKdN2pMOU72fnNqItRjsBwEqO_mSe5AfV1lliCdg/pub","","","","","To register for this course, email academic-registrar@icscanada.edu. Last date to register September 16, 2022. Maximum enrolment of nine (9) students. ICS reserves the right to decline registrations.
Attention TST students: you have to contact the ICS Registrar to complete your registration.*","academic-registrar@icscanada.edu","","9","In Partnership with Calvin University","2022-05-09"
"imagining-the-world-with-ricoeur-525af","FALSE","immersive","","Imagining the World with Ricoeur: Narrative, Action, and the Sacred in Ricoeur's Hermeneutic Phenomenology","","","","","ma mws phd","MA, MWS, PhD","3 Credits","Dr. Ron Kuipers","3","mailto:rkuipers@icscanada.edu","","This course will focus primarily on two essay collections by Paul Ricoeur: *From Text to Action: Essays in Hermeneutics, II*, as well as *Figuring the Sacred: Religion, Narrative, and Imagination*. These collections cover (roughly) a period from the early 1970's to the early 1990's. Together, they form an excellent introduction to Ricoeur's hermeneutical phenomenology, which he developed as an alternative to those theoretical options, such as psychoanalysis and semiotics, with which he struggled throughout the 1960's.","In addition to exploring Ricoeur's evolving thoughts on such topics as textual interpretation, action, imagination, revelation, and a religious imaginary, these essays will also serve seminar participants as an effective springboard into Ricoeur's larger thematic works, such as *Rule of Metaphor, Time and Narrative *(Vols. I-III), *Oneself as Another, or Memory, History, Forgetting*. Beginning with *From Text to Action*, the seminar will explore the general shape of Ricoeur's hermeneutical phenomenology, including such themes as text, action, explanation, understanding, ideology, and utopia.

With this basic grasp of Ricoeur's hermeneutical phenomenology in hand, we will go on to explore his understanding of the disclosive force of religious texts and uses of language in the anthology *Figuring the Sacred*. Among other things, Ricoeur there ponders how Christian communities might best face the task of appropriating a textual heritage from which time has distanced them, and concerning which they have lost a certain original naivety. This seminar will explore Ricoeur's recommendation that Christians risk assuming a ""second naivety"" as they take up the responsibility of receiving and interpreting their religious tradition for a new generation. Imagining the world with Ricoeur, we will discuss how his recommendations on this score might help or hinder our effort to find meaning and inspiration amidst the crises and fragmentations that run through contemporary life.

Dr. Ron Kuipers
ICS 120504 / 220504 F22

ICT3732HS / ICT6732HS L0101*
Remote (Online Synchronous)
Wednesdays, 10:00am - 1:00pm ET

(MWS, MA, PhD)","ICT3732HS","","Wednesdays","10:00am - 1:00pm ET","https://docs.google.com/document/d/e/2PACX-1vQMjVjX2uY7JVogglm7EvbWp-Mw8thlyueTbHUH1HF26PtFeDkyV99tPFk193cfvg/pub","","","","","To register for this course, email academic-registrar@icscanada.edu. Last date to register September 16, 2022. Maximum enrolment of nine (9) students. ICS reserves the right to decline registrations.
Attention TST students: you have to contact the ICS Registrar to complete your registration.*","academic-registrar@icscanada.edu","","9","","2022-05-09"
"ics-2105ac-f22-be0ac","FALSE","partnership","","Meaning/Being/Knowing: The Disciplinary and Interdisciplinary Implications of a Christian Ontology","ICS 2105AC","F22","fall22","Fall 2022","ma phd","MA, PhD","3 Credits","Dr. Nik Ansell","1","mailto:nansell@icscanada.edu","","""Meaning is the being of all that has been created and the nature even of our selfhood."" With these enigmatic words, which form part of the introduction to his magisterial *New Critique of Theoretical Thought*, the neo-Calvinist philosopher Herman Dooyeweerd signals his intention to de-centre the central concern of Ontology by relativizing (which is to say thoroughly relating) the philosophical notion of Being to Meaning, even to the point of (re-)defining creation's being as meaning-all in the conviction that this will enable us to engage in (rather than circumvent or supersede) the work of Ontology (and thus Epistemology) in a truly systematic, integrally Christian, way. Although it might seem as though Dooyeweerd is merely substituting one metaphysical idea for another, his reference to the nature of our selfhood here indicates that, for all its theoretical import for Philosophical Anthropology, this highly suggestive proposal also has profound implications for how we might both appreciate and pull upon our deepest (religious) self-knowledge, which takes shape before the face of God as we face the world. To do the work of Ontology well-to gain genuine insight into the ""nature of things"" and to identify the contours and coherence of the world's general structures without undermining investigation or denaturing experience-will require that we also draw upon a pre-theoretical form of Knowing, and a spiritual grounding and hope, that will always precede and exceed our understanding.","Implicit in Dooyeweerd's vision of and for Ontology, we might say, is the provocative claim that creation does not ""have"" meaning but ""is"" meaning (a paraphrase that, tellingly, uses the language of Being to relativize Being). But what does Dooyeweerd mean by ""meaning""? And what difference might this systematically relational, spiritually open, with-reference-to-self-and-beyond re-centering make (a) to the detailed, nitty-gritty work that needs to be done in any given academic field, and (b) to the theoretical integration that requires both intra- and inter-disciplinary reflection? After an opening discussion about the phenomenon of ""post-truth,"" to which we shall return at the end of the course, we shall explore the inter-play between Meaning, Being, and Knowing via a close reading of Hendrik Hart's *Understanding Our World: An Integral Ontology*, paying careful attention to the ways in which his interpretation of Dooyeweerd's ideas-not least the discussion of ""meaning"" that occurs at the midpoint of his Appendix (see 8.1.4) and in a pivotal section within his central chapter (see 4.4 and 405-406n37)-might deepen our insight into how what is known in faith and articulated via our web of beliefs can help us identify and evaluate the core concepts and the conceptual-ontological connections that play such an integral, influential role in the scholarly disciplines with which we are engaged. In paying attention to developments in Hart's Ontology and Epistemology since the publication of this work, we shall also ask whether the broadly Dooyeweerdian position he initially adopts is as post-metaphysical as it may first appear.

In this iteration of the course, we shall pay special attention to the central concerns of political theory and aesthetics, including their respective interests in the way we posit societal principles and protect, reveal, expand, and find ourselves via the symbols that make up the fabric of our life, history, and society. In further probing the relationship between the aesthetic and political dimensions of created meaning, and between the mystery of our selfhood and the structural contours of reality, we shall also be asking what the development of an Ontology in the Reformational tradition might offer to the scholarly search for disciplinary integrity and interdisciplinary integration-this being a neo-Calvinism in which the unity and diversity we rightly seek are typically seen as covenantally, rather than ontotheologically, grounded.

Given this relational emphasis, we may well wonder what might happen if ""Being"" were to make way for-or make a way for-""Loving."" Perhaps, following Dooyeweerd's (post-metaphysical?) turn to ""Meaning,"" we may find that a Christian scholarly approach to knowing and understanding our world and ourselves ""after Being"" may have something new to say to the peril and promise of life ""post-truth""!

Dr. Nik Ansell","","","Thursdays","6:00pm - 9:00pm ET","https://docs.google.com/document/d/e/2PACX-1vQKwndHW1XYlLQ9ysmXNrZsDlDbUif4ZBHSq78YOym6SDDY8bfAiUGsFU700zg45Q/pub","","NOTE: This course is only available to ICS Junior Members. Completion of 1107AC or 2107AC is a prerequisite for enrolling in this course.*","","","","","","","In Partnership with Calvin University","2022-05-09"
"the-craft-of-reflective-practice-99acb","FALSE","concentration-instr","","The Craft of Reflective Practice","","","","","cstc mael mws","CSTC, MA-EL, MWS","3 Credits","Dr. Gideon Strauss","5","mailto:gstrauss@icscanada.edu","","We humans make sense of things by telling stories. In this course we will learn how to do critical reflective practice, primarily by telling stories about our everyday professional lives. We will zoom in on the story of an ordinary day at work, and then zoom out to the story of our career to date, zoom out further to the story of our work community, and zoom out even further to the overarching story of God's world. In the process we will learn qualitative research skills, receive an introduction to phenomenology (the philosophical study of lived experience), develop our own approach to praxis (that is, the craft of morally-oriented, theoretically-informed, and theory-generating critically reflective practice), and, most significantly, come to terms with who we are in what we do.","","","","","","https://docs.google.com/document/d/e/2PACX-1vS09jKytfeTY_Mv7Rah-PELBM-NXvva6maFTocIXfNaf5kpB2TPejyZpA13suOy9roWoGPbTdM-Uwf5/pub","","","","CSTC","(MWS, MA-EL)

Syllabus

Enrolment Notes:
To register for this course, email academic-registrar@icscanada.edu. Last date to register September 16, 2022. Maximum enrolment of nine (9) students. ICS reserves the right to decline registrations.

Approved for Area 2 of the CSTC*","academic-registrar@icscanada.edu","","9","","2022-05-09"
"icsd-260006-f22-32097","FALSE","concentration-instr","","Transformative Teaching:  The Role of a Christian Educator","ICSD 260006","F22","fall22","Fall 2022","cstc mael","MA-EL","3 Credits","Dr. Edith van der Boom","2","mailto:evanderboom@icscanada.edu","","Transformative Teaching is a course for instructional leaders as they consider their roles as Christian educators called to be transformers of society and culture by seeking justice for those who are marginalized and disenfranchised. In this course we will consider constructivism (a dominant educational theory in the twenty-first century that informs student-centred pedagogies such as Project Based Learning) through the lens of Scripture and investigate the assumptions that it makes. We will explore our calling as Christian educators to transform culture in our schools, local community, and the world.","This course seeks to help Christian educators find clarity in answers to the following questions:

Context: Who am I called to be as a Christian educator in my particular place and time?

Constructivism: How does constructivism inform my practice?

Culture: What role does education play in creating culture?

Dr. Edith van der Boom","","Blended (Online Asynchronous/Synchronous)","","","https://docs.google.com/document/d/e/2PACX-1vSOmzHcsgse4d30OyZeK86LWZhfJSOfymOyuMZPB3x3T9e3YuC9XZarfWnC3-hGqHHNFc-C9VxsDPti/pub","","","","CSTC","To register for this course, email academic-registrar@icscanada.edu. Last date to register September 16, 2022. Maximum enrolment of nine (9) students. ICS reserves the right to decline registrations.
Approved for Area 2 of the CSTC*","academic-registrar@icscanada.edu","","9","","2022-05-09"
